用户名,用户城市,评论内容,点赞数,评论时间,情感得分
友好呆猪毛____见过汪苏泷版,江苏,谁懂《像晴天像雨天》➕《忽而今夏》➕《耿》➕《眼泪落下之前》的含金量啊[哭哭][哭哭][哭哭],334,2025-11-21 20:28:16,0.9998785344070619
Beauty_sh,江西,为什么牛上天了，因为牛飞了！[搞怪] 为什么牛生病了，因为牛坏了！[心动],120,2025-11-21 23:08:24,0.9437308979518382
今天晒太阳了吗_17,广东,原来的版本是两个人双向奔赴，喜欢更热烈，给人很欢快愉悦的感觉，happy ending；改编的版本更偏向于一方暗恋另一方，有种回忆怀念的感觉，偏向于悲伤的结局（我在某书看到的 听的时候也是我的第一感受[泪目]）,64,2025-11-22 03:06:58,0.999999999992756
8881claire,北京,“一定要文采斐然吗 我磕磕绊绊的叙意不清的词句不也是爱吗”,54,2025-11-22 00:31:38,0.4109376466231218
陈穆谦,陕西,这个歌半年来演唱会+音乐节+各种活动已经“唱烂”了，现在居然还能改编成这样，巨好听，太牛了汪苏泷,47,2025-11-21 23:16:35,0.4521870220282298
我爱泡芙OvO,江苏,泷哥还是一直想当rapper哈哈哈哈,44,2025-11-21 23:18:43,0.9130024906338045
-宋煜SongYu,浙江,你离开了家 在他乡有人照顾你吗 在外地打工人破防了[哭哭][哭哭][哭哭],41,2025-11-21 21:03:44,0.9966530814156522
是浅笑w,安徽,改编好好听啊 那个盛夏再也不会有遗憾了,39,2025-11-21 23:49:57,0.7175349714004522
唯美苏音音你不凡,四川,泷哥巧妙地将《耿》的执念与《忽而今夏》的慨叹，编织进这首歌的晴雨交错里。用音乐诠释了生活的多面模样一有晴天的明媚，也有雨天的柔软，而每一次唱出，都是对爱与生活的深刻告白。,26,2025-11-22 01:42:35,0.9999978702389443
如果你也听-汪苏泷,江苏,谁是被汪苏泷的私信召唤过来的[色][色][色],23,2025-11-21 22:13:55,0.890247095628838
微草战队队长夫人,江西,原版的一声声好喜欢你，是青春期真挚热烈的感情，少年时代的爱情总是花团锦簇，我的世界全部在热烈地宣告着对你的喜欢。  但是改编版的，更成熟了，回忆起爱情，除了真诚之外，也明白了爱情并不都是花团锦簇，它还会有悲伤、会有酸涩、会有眼泪。但喜欢就是，即使知道会掉眼泪，但我还是选择喜欢你🫶🏻,21,2025-11-21 21:57:14,1.0
锅贴_qwj,浙江,早说要改新版的了 我就抢杭州的罗曼城了 wok杭州肯定要唱这个版本了,16,2025-11-21 22:40:41,0.882372654144441
悲傷烤紅薯plus,广东,牛为什么生病了！！！,16,2025-11-21 21:54:10,0.23795856728951936
嘻歪日记,天津,两只手指向中间划有惊喜 一→         ←一,15,2025-11-21 23:27:03,0.6320122585833057
挽溪OvO,辽宁,歌词里有耿和忽而今夏哦[心动][心动],15,2025-11-21 23:13:58,0.9949163563794646
QingNing-Xu,福建,汪苏泷！好听！好听！好听！,1,2025-11-23 16:40:48,0.4631062773985808
原来是优秀呢,山东,点赞了[爱心] 　　　　　　 ＿＿ 　　　　　／＞　　フ 　　　　　|  　_　 _ l 　 　　　／` ミ＿꒳ノ 　　 　 /　　　 　 | 　　　 /　 ヽ　　 ﾉ 　 　 │　　|　|　| 　／￣|　　 |　|　| 　| (￣ヽ＿_ヽ_)__) 　＼二つ,1,2025-11-23 16:10:32,0.9999999385912277
浅梦黛熏,广东,你离开了家,0,2025-11-23 16:44:29,0.44906370445109267
Cris_1102,河南,为什么牛上天了，因为牛飞了！ 为什么牛生病了，因为牛坏了！,0,2025-11-23 16:44:26,0.6669171294968386
Cris_1102,河南,单曲循环了,0,2025-11-23 16:42:55,0.09093661119089869
汪汪台长,广东,有多少惦念 尽量把话说的简短些 记忆如秋千反复在脑海盘旋,0,2025-11-23 16:41:17,0.9997316583498241
汪汪台长,广东,喜欢秋天 落叶、柿子、桂花的香味 喜欢见面的一切,0,2025-11-23 16:41:03,0.9949204497507601
汪汪台长,广东,冬天来了 春天就不远咯,0,2025-11-23 16:33:07,0.8289556375268328
汪汪台长,广东,不管晴天雨天 见面就是最好的一天,0,2025-11-23 16:32:51,0.34328965096189934
友好呆猪毛____见过汪苏泷版,江苏,啊啊啊啊啊啊啊！！！！,0,2025-11-23 16:31:55,0.8544158684082782
longing-s,湖北,汪汪音乐班[心动],0,2025-11-23 16:16:04,0.7561776199719533
longing-s,湖北,好听好听好听,0,2025-11-23 16:15:54,0.09199658582952375
惖泷,江苏,牛飞了！！！,0,2025-11-23 16:15:51,0.3574178802448319
惖泷,江苏,汪苏泷简直就是天才,0,2025-11-23 16:14:13,0.6392910534054803
惖泷,江苏,太好听了🤩,0,2025-11-23 16:14:04,0.17519096105991316
冰糖蓝莓orz,上海,没有人照顾我,0,2025-11-23 16:10:56,0.9699297317826221
哎哟呀喂喂喂喂,江苏,汪苏泷最帅最好听,0,2025-11-23 16:08:38,0.9782136711993995
哎哟呀喂喂喂喂,江苏,汪苏泷最帅最好听,0,2025-11-23 16:08:25,0.9782136711993995
哎哟呀喂喂喂喂,江苏,汪苏泷最帅最好听,0,2025-11-23 16:08:06,0.9782136711993995
哎哟呀喂喂喂喂,江苏,汪苏泷最帅最好听,0,2025-11-23 16:08:02,0.9782136711993995
哎哟呀喂喂喂喂,江苏,汪苏泷最帅最好听,0,2025-11-23 16:07:58,0.9782136711993995
哎哟呀喂喂喂喂,江苏,汪苏泷最帅最好听,0,2025-11-23 16:07:51,0.9782136711993995
哎哟呀喂喂喂喂,江苏,汪苏泷最帅最好听,0,2025-11-23 16:07:45,0.9782136711993995
哎哟呀喂喂喂喂,江苏,汪苏泷最帅最好听,0,2025-11-23 16:07:40,0.9782136711993995
哎哟呀喂喂喂喂,江苏,汪苏泷最帅最好听,0,2025-11-23 16:07:36,0.9782136711993995
